"nyt_2010_2017_nopick.display_title","summary_short"
"Front Cover","This gay romance written and directed by Ray Yeung takes a gentle thoughtful look at the intersection of ethnicity and sexuality"
"Fugly!","8220Fugly8221 John Leguizamo8217s bittersweet new comedy mixes narrative and standup comedy embellished with clever animation by Bill Plympton"
"Fukrey","The Hindi comedy Fukrey directed by Mrighdeep Singh Lamba follows the tribulations of four young Delhiites"
"Fullmetal Alchemist: The Sacred Star of Milos","The Elric brothers of Fullmetal Alchemist return to the animated screen to continue their quest for a philosophers stone"
"Fun Mom Dinner","In this comedy Toni Collette Molly Shannon Bridget Everett and Katie Aselton are out to prove that mothers can have fun too"
"Furious 7","Lots of familiar faces and speed demons are back for the latest in the franchise"
"Furry Vengeance","Animals plot the harassment of Brendan Fraser and Brooke Shields in Roger Kumbles Furry Vengeance"
"Fury","Brad Pitt returns to Nazi killing in 8220Fury8221 this time leading a tank crew during the vicious bloody final battles of World War II"
"G.B.F.","Every mean girl needs a gay male best friend at least thats what the teenagers in GBF believe"
"G.I. Joe: Retaliation","Noise and heavy weaponry are major players in this followup to GI Joe Rise of the Cobra"
"Gabriel","An obsessive and troubled Gabriel leaves a psychiatric hospital and strains the lives of his loving mother and childhood girlfriend in this tense film"
"Gaga: Five Foot Two","This documentary depicts Lady Gaga as a disciplined accomplished performer but one who inhabits a peculiar isolation despite her fame"
"Gangster Squad","Gangster Squad is a throwback to another time with some character voices reminiscent of McGruff and Offissa Pupp thrown in"
"Garbo: The Spy","Garbo the Spy is about the derringdo of the World War II double agent Juan Pujol Garca and told with the flair of a Hollywood spy movie"
"Gardeners of Eden","The film interviews a poacher as well as those trying to save the elephant population in Africa"
"Garnet’s Gold","This documentary by Ed Perkins chronicles a search for a stash of gold but also ends up telling a larger story about one mans life"
"General Orders No. 9","General Orders No 9 is a tone poem laid over 72 minutes worth of images in what seems at first like just an ode to nature"
"Generation P","Set in early postSoviet Russia Generation P is the story of a disillusioned poetturnedadman searching for spirituality in the trash can of the marketplace"
"Genius","Michael Grandages 1930sera biopic is nostalgia for a supposed golden age of masculine artistic potency"
"Genius on Hold","Truth is stranger than fiction in Genius on Hold in which an inventor works with bookies and his son becomes a thief"
"Genius Within: The Inner Life of Glenn Gould","An appraisal of the Canadian pianist Glenn Gould who remains an object of fervent admiration nearly 30 years after his death"
"Geostorm","In this action film the world is threatened by a spacebased weathercontrol system armed with ice fire hail and heavy rain"
"Gerhard Richter Painting","This film by Corinna Belz is an exploration of Mr Richters working process"
"Germans & Jews","In Janina Quints documentary a group of Jewish and nonJewish Germans most of them born after World War II reckon with the past"
"Gerrymandering","Jeff Reicherts documentary looks at the long history of shaping electoral districts for political ends"
"Get Hard","The comic premise of this film could hardly be simpler Mr Ferrell is white Mr Hart in contrast is black"
"Get Him to the Greek","Sometimes debauchery can serve as nostalgia as in Get Him to the Greek"
"Get Low","Aaron Schneider directs Robert Duvall in the true story of a man who wants to enjoy his own funeral"
"Get Me Roger Stone","The operative Roger J Stone Jr has a scandalous history a Nixon tattoo and boldfaced acquaintances including President Trump all explored in this documentary"
"Getaway","In Getaway a former professional racecar drivers wife is kidnapped and he is warned that he will never see her again unless he steals a vehicle and follows instructions"
"Ghanchakkar","A bank robbery and amnesia are central elements of the Bollywood comedy Ghanchakkar"
"Ghost in the Shell","Scarlett Johansson playing a cyborg called Major rises above it all in the thrillfree science fiction thriller"
"Ghost Rider: Spirit of Vengeance 3D","Ghost Rider Spirit of Vengeance stars Nicolas Cage in a sequel to the 2007 film"
"Ghostbusters","This redo lets women especially Kate McKinnon be as simply and uncomplicatedly funny as men and still leaves room for Chris Hemsworth"
"Gifted","A young math prodigy and her strong bond with her uncle are tested when a debate arises over whether to cultivate her abilities or let her be a child"
"Gilbert","These documentaries go behind the scenes with their wellknown subjects Rose Marie and Gilbert Gottfried"
"Girls Against Boys","In Girls Against Boys men are pigs women are sick of it and revengefueled death and dismemberment pass for feminist critique"
"Girls Trip","In the affably amusing sometimes spittingly funny Girls Trip a weekend getaway brings trouble laughs and sisterhood"
"Giuseppe Makes a Movie","Adam Rifkin8217s new documentary follows Giuseppe Andrews as he rounds up his neighbors at a trailer park and assorted transients to shoot his latest film"
"Glass Chin","This story of a New Yorkarea loan shark restaurateur and boxing coach is full of hyperstylized shots philosophizing speeches and nowayout plotting"
"Glee The 3D Concert Movie","Glee The 3D Concert Movie notes just how terrific it is to be yourself"
"GMO OMG","GMO OMG a documentary from the director Jeremy Seifert tries to inform viewers about food in America"
"Gnomeo & Juliet","When the humans are away the lawn ornaments come out to feud or court in Gnomeo and Juliet"
"Go For It!","Carmen Marrons Go for It starring Aimee Garcia is a briskly edited danceoutoftheslums story that speaks to workingclass young women"
"Goat","Nick Jonas and Ben Schnetzer star in this disturbing tale about the urge to belong no matter what the cost"
"Goats","Goats directed by Christopher Neil is a modernday comingofage story"
"God Help The Girl","Fresh out of a psychiatric clinic a young woman in Glasgow teams up with a lifeguard and a rich girl to form a band in God Help the Girl"
"Gods of Egypt","Alex Proyass specialeffects extravaganza set in antiquity is an embarrassment of kitsch riches with intermittent moments of wit"
"Godzilla","Godzilla everybodys favorite skyscraper stomper returns in a remake directed by Gareth Edwards and hes showing some familiar generational traits"
"Going in Style","Michael Caine Alan Arkin and Morgan Freeman star in a comedy about old dudes who rob a bank a remake of a 1979 movie"
"Going the Distance","In Going the Distance Drew Barrymore and Justin Long are young lovers struggling through a crosscountry romance"
"Golf in the Kingdom","Golf in the Kingdom directed by Susan Streitfeld brings the cult novel by Michael Murphy to the screen"
"Gone","An abduction that may or may not have happened and a disappearing sister are enough to push a spooked young woman over the edge in Gone"
"Gone Girl","8220Gone Girl8221 David Fincher8217s movie adaptation of Gillian Flynn8217s best seller focuses on a young wife who goes missing"
"Good For Nothing","In Good for Nothing an Englishwoman in America is taken hostage by an unnamed man who cant achieve his predatory designs"
"Good Ol' Freda","Good Ol Freda chats with Freda Kelly the onetime secretary for the Beatles but shes not dishing much"
"Good Time","Robert Pattinson plays a nottoobright bank robber on the run in Josh and Benny Safdies latest film Good Time"
"Goodbye World","In Goodbye World a violent breakdown in society prompts friends to reunite at the home of a couple who live off the grid"
"Goosebumps","The bulk of this movie is a jampacked popup book in the form of computergenerated imagery"
"Grand Slammed","In Grand Slammed an aspiring pitcher is hampered by bad luck and bad friends in his attempt to reach a better life"
"Granito: How to Nail A Dictator","In Granito How to Nail a Dictator Pamela Yates follows up on her earlier film When the Mountains Tremble"
"Grave Encounters","Grave Encounters is a mockumentary set in a familiar setting a spooky old asylum"
"Great Expectations","Mike Newells new version of Great Expectations features supporting work by Ralph Fiennes and Helena Bonham Carter"
"Greedy Lying Bastards","In Greedy Lying Bastards Craig Scott Rosebraugh sets out to kick globalwarmingdenying corporate keisters"
"Green","In Green a couples friendship with a woman is the source of tension"
"Green Lantern","Ryan Reynolds plays the emeraldhued superhero in a 150 million diversion"
"Greencard Warriors","Greencard Warriors follows a family that will do almost anything for papers"
"Gringo Trails","Gringo Trails a documentary by Pegi Vail considers the impact adventure tourists have on the exotic locations they visit"
"Growing Up Smith","This gentle comingofage film centers on a youngster caught between two cultures and struggling to adapt in suburbia"
"Grown Ups","Grown Ups is a sloppy entry into this years manchildcomedy sweepstakes"
"Grown Ups 2","Grown Ups 2 features many of the same former Saturday Night Live stars as Grown Ups but theyve moved to New England from Los Angeles"
"Grudge Match","8220Grudge Match8221 teams Sylvester Stallone and Robert De Niro as onetime boxing champions in an unlikely rematch 30 years after their last bout"
"Guardians of the Galaxy","Guardians of the Galaxy starring Chris Pratt is one of those interstellar westerns about a motley group of appealing baddies who rise to the occasion"
"Guardians of the Galaxy Vol. 2","Chris Pratt Zoe Saldana and the crew are back for this sequel to the 2014 hit about a ragtag group of futuristic fighters"
"Guitar Innovators: John Fahey & Nels Cline","Guitar Innovators John Fahey and Nels Cline is a slate of two documentaries each looking at a different musician"
"Gulliver's Travels","Jonathan Swift takes a long trek to assess the modern cinematic take on his most famous creation"
"Habermann","Habermann by Juraj Herz is a wartime soap opera based on the expulsion of ethnic Germans from parts of Europe"
"Hacksaw Ridge","Mel Gibsons new film tells the true story of Desmond Doss a conscientious objector who refused to bear arms but still won the Medal of Honor in World War II"
"Hadewijch","Bruno Dumonts austere grimly luminous film Hadewijch follows a young woman from a convent to the projects of Paris where she learns about Islam"
"Hail, Caesar!","Joel and Ethan Coen meander in and around their Tinseltown dream factory cracking jokes in a film set a decade after Barton Finks meltdown"
"Half of a Yellow Sun","Chiwetel Ejiofor and Thandie Newton star in Half of a Yellow Sun set during the 1960s in a newly independent Nigeria"
"Half The Road","In this documentary Kathryn Bertine an athlete and former ESPN columnist questions the maledominated world of professional cycling"
"Hall Pass","In the Farrelly brothers Hall Pass two men suffering marital fatigue get a week off from their marriages Let the ogling commence"
"Hamari Adhuri Kahani","Mohit Suri8217s melodramatic film finds time amid its globetrotting adventure to comment on domestic abuse in India"
"Hamlet","Bruce Ramsays Hamlet is set in an upperclass buttoneddown home in postwar London"
"Hands of Stone","Jonathan Jakubowiczs film has scattered pleasures like Mr De Niros performance as Roberto Durns trainer But the boxing scenes do not come within swinging distance of Raging Bull"
"Handsome Devil","Two unlikely friends at an allboys school in Ireland must survive their classmates bullying with the help of a sympathetic teacher"
"Hangman","The detectives in this serialkiller thriller cant even be bothered to solve the word puzzle"
"HANK: Five Years From the Brink","In Joe Berlingers documentary Hank Five Years from the Brink Henry M Paulson Jr the former Treasury secretary works his way through a timeline"
"Hanna","A girl in the wilds of Finland is raised to be a highly efficient killing machine"
"Hansel and Gretel: Witch Hunters","Hansel and Gretel all grown up and perhaps traumatized by their childhood use their fury against their captor to help others"
"Happy Feet Two","In Happy Feet Two the penguin Erik has issues namely he cant dance"
"Happy New Year","8220Happy New Year8221 stars Shah Rukh Khan as a fighter intent on stealing a badguy diamond dealer8217s gems during a dance competition in Dubai"
"Happy, Happy","Wearing a satirical smirk Happy Happy sets out to puncture the clichd image of Scandinavians as rosycheeked choristers bonded in communal togetherness"
"Hara-Kiri: Death of a Samurai","In Takashi Miikes HaraKiri Death of a Samurai a samurai cast adrift arrives at the estate of a feudal lord requesting permission to commit ritual suicide in the courtyard"
"Hard Labor","The filmmakers at times evoke the ambient dread and decay of say Roman Polanskis Repulsion"
"Hardcore Henry","This Ilya Naishuller film has the look of a firstpersonshooter video game"
"Harmony and Me","Harmony and Me is a lowfi comedy of sulks and selfpity"
"Harry Benson: Shoot First","This adulatory profile focuses on a photojournalist who has documented many highprofile figures but it skips some hard questions"
"Harry Brown","Michael Caine brings the memory of his great roles to every part he plays"
"Hasee Toh Phasee","In Hasee Toh Phasee a wedding is approaching but the groom has some things on his mind including his fiances longestranged sister"
"Have You Heard from Johannesburg?","Connie Fields sevenpart documentary chronicles the fight against apartheid"
"Hawaizaada","8220Hawaizaada8221 wraps itself in a love story but its main focus is on a pair of aviation pioneers in India who are said to have designed an airplane in 1895 before the Wright brothers"
"Haywire","Haywire directed by Steven Soderbergh and starring the mixed martial arts fighter Gina Carano delights in its own action"
"He's Way More Famous Than You","In Hes Way More Famous Than You a fallen starlet is dumped by her filmmaker boyfriend"
"Heartless","Jim Sturgess plays a painfully shy young man in Heartless Philip Ridleys arthouseaspiring horror movie set in East London"
"Heaven is for Real","The 2010 bestselling book Heaven Is for Real has made it to the screen starring Greg Kinnear"
"Hell and Back Again","Hell and Back Again a documentary by Danfung Dennis follows Sgt Nathan Harris a Marine recovering from a shattered hip and leg"
"Hello Again","This film from Tom Gustafson based on a 1993 Off Broadway show has a formidable cast of Broadway names but wants for dramatic traction"
"Hello Herman","Hello Herman adapted from John Buffalo Mailers 2001 play depicts a bullied 16yearold who slaughters dozens of classmates and several adults"
"Heneral Luna","The film tells the story of Antonio Luna who in the late 1800s led the Philippine Revolutionary Army during the PhilippineAmerican War"
"Herb & Dorothy 50x50","Herb  Dorothy 50x50 visits some of the museums given artworks from the Vogel collection"
"Herblock - The Black & The White","The documentary Herblock The Black  the White tells the life story of the editorial cartoonist Herbert Block"
"Hercules","Dwayne Johnson plays the title role in Hercules a piece of tongueincheek revisionist mythology directed by Brett Ratner"
"Here and There","In Here and There a depressed New Yorker opens up in dreary Belgrade"
"Here Come the Videofreex","This concise and informative documentary follows the early adopters of a lightweight recordplayback model by Sony in 1968"
"Here Comes the Boom","In Here Comes the Boom Kevin James plays a teacher determined to save his high schools music program by earning money in mixed martial arts bouts"
"Hey Bartender","Hey Bartender is Douglas Tirolas documentary ode to highend mixologists"
"Hey, Boo: Harper Lee & To Kill A Mockingbird","Mary McDonagh Murphys documentary tells how To Kill a Mockingbird was written and how it influenced America"
"Hidden Figures","The women part of the giant step for mankind have their stories told in this movie directed by Theodore Melfi"
"Hideaway","In this film by Franois Ozon a young pregnant woman who loses her lover to drugs lands in unexpected places"
"High Strung","The movie in which two young artists fall for each other is energized by Dave Scotts choreography"
"High Tech, Low Life","The documentary High Tech Low Life follows two very different Chinese bloggers who try to report what the governmentcontrolled press wont"
"Hillary’s America","The conservative authors film paints a forbidding portrait of Hillary Clinton and her fellow Democrats"
"Hillsong — Let Hope Rise","This sleepy documentary about Hillside United is a portrait of singing worship leaders and swaying fans who join in generic anthems at a Los Angeles concert"
"Himmatwala","Himmatwala is a remake of a Bollywood disco film from 30 years ago"
"Hippocrates: Diary of a French Doctor","This film subtitled 8220Diary of a French Doctor8221 unfolds pretty much like an average episode of 8220ER8221 though with more French flag waving and less storeroom romancing"
"Hit And Run","Hit  Run stars Dax Shepard as a goofball in the witness protection program who is soon back in trouble"
"Hit By Lightning","8220Hit by Lightning8221 is a parody of 8220Double Indemnity8221 involving a man Jon Cryer venturing into online dating only to meet a femme fatale"
"Hitchcock","Hitchcock starring Anthony Hopkins is based on a book about the making of the horror classic Psycho"
"Hitman: Agent 47","In Aleksander Bach8217s revival of a franchise based on a video game Mr Friend plays the genetically engineered assassinhero"
"Hockney","This sunny film with occasional clouds looks at David Hockneys life his losses and his works reflections of his immersion in Southern California"
"Hollow in the Land","When the brother of Dianna Agrons character is accused of murder its up to her to save him and their family reputation"
"Hollywood to Dollywood","In Hollywood to Dollywood Gary and Larry Lane gay identical twins travel from Los Angeles to the Dollywood theme park in Pigeon Forge Tenn"
"Holy Hell","A member pursues and documents a cult leader whose persona devolves from charismatic to creepy in this documentary"
"Home","Jim Parsons and Rihanna star in this animated film about an intergalactic friendship"
"Home Again","Reese Witherspoon plays cute and single in a mirthless romantic comedy in a movie by Hallie MeyersShyer the daughter of Nancy Meyers and Charles Shyer"
"Home:____","In Home a mentally ill resident of a New York group home tries to find a place of his own"
"Homefront","Homefront with Winona Ryder James Franco and Jason Statham packs plenty of drugs and violence into its Louisiana setting"
"Homemakers","This jaggededged indie from Colin Healey is about a wildchild drama queen who moves to Pittsburgh to renovate a house her grandfather has left her"
"Honeymoons","The first AlbanianSerbian coproduction the film Honeymoons unsurprisingly about ethnic biases and tensions has the courage to end in a kind of limbo"
"Hood To Coast","Hood to Coast is a documentary about a nutty relay race in Oregon"
"Hoodwinked Too! Hood vs. Evil","Hoodwinked Too Hood vs Evil drops Red Riding Hood and other fairytale characters into a spy movie"
"Hop","Hop a Christianityfree Easter tale of rabbits and humans stars Hugh Laurie and Russell Brand"
"Hope Springs","Hope Springs brings Meryl Streep and Tommy Lee Jones together as a couple in a longtime marriage thats gone dry Enter a therapist Steve Carell"
"Horns","In 8220Horns8221 starring Daniel Radcliffe people start confessing their evil desires and doings to a young man after he suddenly sprouts horns"
"Horrible Bosses","In Horrible Bosses a foulmouthed and frequently funny new comedy of male resentment directed by Seth Gordon employees plot revenge"
"Horrible Bosses 2","An invention is part of the plot of 8220Horrible Bosses 28221 a sequel that tries to recapture the zany feel of the original film"
"Hot Pursuit","The women one the wife of a criminal and the other a police officer are thrown together by improbable circumstances in this buddy comedy"
"Hot Tub Time Machine 2","The sequel to Hot Tub Time Machine features Rob Corddry and Craig Robinson playing characters who have benefited from learning about the future in the first film"
"Hotel Transylvania","In the vividly animated Hotel Transylvania Dracula has a daughter who falls for a human backpacker who strays into their monstersonly inn"
"Hotel Transylvania 2","In this sequel Draculas daughter has married a human and begotten a son and her father worries that the boy may not be vampirish enough"
"House At the End of the Street","A mother and daughter move into a house in a neighborhood with a grim history in this unwieldy hybrid of Psycho and standard teenage horror films"
"House of Boys","In House of Boys the director JeanClaude Schlim looks at coming of age at the onset of AIDS"
"House of Pleasures","House of Pleasures directed by Bertrand Bonello is not an erotic stimulant so much as a slowmoving increasingly tragic and claustrophobic operatic pageant set almost entirely in a brothel"
"How Do You Know","Reese Witherspoon stars in a comedy written and directed by James L Brooks"
"How He Fell in Love","This Marc Meyers film focuses on how the relationship between a young musician and a middleage woman affects them and others in their orbit"
"How Heavy This Hammer","Written and directed by Kazik Radwanski this film was shot in practically all handheld almost closeups"
"How to Be a Latin Lover","In this goodnatured comedy the Mexican actor and comedian has been dumped and has to settle for real life"
"How to Be Single","This adventure which stars Dakota Johnson flops even with Leslie Mann and Rebel Wilson hard at work being funny"
"How To Grow A Band","How to Grow a Band is the story of the fusion quintet the Punch Brothers"
"How to Train Your Dragon","A young man betrays his warlike tribe and learns to love the enemy"
"How to Train Your Dragon 2","How to Train Your Dragon 2 the sequel to the 2010 blockbuster from DreamWorks Animation is considerably darker and more selfaware than its forerunner"
"Hubble 3D","Hubble 3D is dazzling to look at of course But such ponderous clichheavy narration"
"Hunky Dory","In Hunky Dory a drama teacher persuades her pupils to stage a rock opera based on The Tempest"
"Huntwatch","This film onesided in its approach offers painful footage of the bludgeoning of pups in charting the decadesold movement against seal hunting"
"Hyena","As kingpins do battle in London in Gerald Johnson8217s drama there8217s plenty of human trafficking drug smuggling and viscera"
"I Am","I Am a documentary by Tom Shadyac looks to shed light on some big questions"
"I Am Breathing","I Am Breathing delicately chronicles the final months of Neil Platt a resilient young Scotsman stricken with Lou Gehrigs disease"
"I Am Chris Farley","In this documentary about the comedian colleagues recall Mr Farley8217s exuberantly physical humor and invented characters including the motivational speaker who lived 8220in a van down by the river8221"
"I Am I","The daughter of the screenwriter Roger Towne directs writes and stars in her own film I Am I"
"I Am Jane Doe","This documentary is a chronicle of the fight to hold an online classifieds site liable for children being sold into sex slavery"
"I Am Not Madame Bovary","A Chinese comedic melodrama with a divorce of convenience followed by a real jilting has situational intrigue marred by a labored approach"
"I Am Number Four","Directed by D J Caruso I Am Number Four is a high school movie with a dollop of science fiction teenage aliens are being pursued by evil Mogadorians"
"I Called Him Morgan","The director Kasper Collin has created a suave and sensitive documentary about the life and death of the great trumpeter Lee Morgan"
"I Do... Until I Don't","Three married couples outwit a documentary filmmaker in Lake Bells sex comedy"
"I Don't Know How She Does It","In I Dont Know How She Does It Sarah Jessica Parker portrays a woman who has it all though the movie inadvertently makes her characters supposedly golden life look like a living hell"
"I Dream in Another Language","In the film a linguist seeks to keep a language alive but the only two men who speak it arent interested"
"I Saw the Light","The British actor Tom Hiddleston stars and sings as the music legend leading with charm and a twang in this film written and directed by Marc Abraham"
"I Send You This Place","Andrea Sisson and Pete Ohs feature Icelands natural wonders and Ms Sissons philosophical ruminations in I Send You This Place"
"I Touched All Your Stuff","An American computer technician serving time in a Brazilian jail recounts his illfated obsession with a mysterious femme fatale who may or may not exist"
"I Travel Because I Have To, I Come Back Because I Love You","As singular as its title I Travel Because I Have To I Come Back Because I Love You embraces road movie personal journal and trancelike study of arcing grief"
"I Will Follow You Into the Dark","In I Will Follow You Into the Dark Mischa Barton is a religious skeptic whose boyfriend mysteriously disappears"
"I, Frankenstein","Aaron Eckhart plays a version of Mary Shelleys monster in the new film I Frankenstein also starring Bill Nighy"
"I, Olga Hepnarová","This Czech film gives a haunting account of the life of the mentally ill young woman who killed eight people in Prague in 1973"
"I, Tonya","In this winking biopic Margot Robbie plays the disgraced ice skater Tonya Harding"
"I.T.","This thriller features a computercontrolled home owned by a businessman who isnt very savvy when it comes to guarding his privacy from wrongdoers"
