"nyt_2010_2017_nopick.display_title","summary_short"
"'Til Madness Do Us Part","Wang Bings documentary about a mental hospital in China is overlong but sporadically extraordinary"
"(T)error","This documentary raises questions about the agencys methods as an informant is told to persist with an inquiry after he concludes that its target is not a serious threat"
"#Horror","In this feature directorial debut by Tara Subkoff girls neglected by their parents and obsessed with their cellphones fall prey to perils of the online world"
"#Stuck","8220Stuck8221 centers on a couple who meet at a bar spend the night together and then endure being caught in a morning traffic jam"
"1 Night","This debut feature by Minhal Baig has two high school students a couple in their 30s and a dash of charm"
"10 Rules for Sleeping Around","10 Rules for Sleeping Around about one couple who allow each other to fool around and another that doesnt combines nudity and jokes but fails to be a sex comedy"
"10 Years","In the high school reunion comedy 10 Years some old classmates are struggling to grow up"
"10,000 KM","Carlos MarquesMarcets film about a couples shift to a longdistance relationship looks at the role technology plays in negotiating absence"
"100 Streets","Idris Elba is among the stars of this Jim OHanlon film a convergingnarratives movie set in London"
"1000 Rupee Note","In this film set in the Maharashtra State of India a villager sets off on a fraught shopping trip after receiving a few 1000rupee notes at a political rally"
"11:55","Ari Issler and Ben Snyders intimate feature focuses on a young soldier who comes back from Afghanistan to face the fallout from a longago crime"
"12 O'Clock Boys","The documentary 12 OClock Boys follows a youth through his initiation into a group of dirt bike riders who like to taunt the police"
"13 Hours: The Secret Soldiers of Benghazi","Mr Bay has moderately scaled back his extremecinema approach for the story about the attack on the American diplomatic mission in 2012"
"13 Minutes","A German biopic tells the story of Georg Elser a carpenter who tried to blow up the Fhrer in 1939"
"14 Blades","In 14 Blades by Daniel Lee a martial arts master must escape to Chinas far frontier"
"16-Love","In 16Love Lindsey Shaw plays a teenager who finds theres life and romance off the tennis court"
"1st Night","Mozarts comic opera Cos Fan Tutte inspires a subplot in the movie 1st Night directed by Christopher Menaul"
"2 Guns","The Baltasar Kormakur buddy film 2 Guns turns on a pair of seemingly bad guys who may be good out to rob a drug cartels money from a bank"
"2 Jacks","Two Jacks adapted from a short Tolstoy novel is a satirical comedy about Hollywood nepotism and wheeling and dealing"
"20 Feet From Stardom","The documentary 20 Feet From Stardom seeks to rewrite the history of pop music by focusing attention on voices at once marginal and vital"
"2011-08-16","The documentary followed more than 16 people to the polls on Election Day to learn about their thoughts and feelings on the candidates"
"2012-12-12","The documentary 121212 goes behind the scenes at the Concert for Sandy Relief with Bruce Springsteen the Rolling Stones and Kanye West"
"21 and Over","21  Over the directorial debut of the Hangover screenwriting team Jon Lucas and Scott Moore follows an odd couple through a night of juvenile debauchery"
"21 Jump Street","The movie 21 Jump Street is full of the usual boycomedy stuff and though no conceptual ground is broken the whole mess is silly spirited and yes smart enough to work"
"22 Jump Street","In 22 Jump Street Jonah Hill and Channing Tatum reprise their role as police partners this time going undercover on a college campus"
"23 Blast","Dylan Baker directs 822023 Blast8221 based on the true story of a high school football player who lost his sight"
"24 Exposures","A photographer who takes what he calls fetish photos is the subject of 24 Exposures"
"28 Hotel Rooms","In 28 Hotel Rooms an unnamed couple meet in a hotel bar have a onenight stand and begin a longrunning clandestine affair"
"3 Days to Kill","In 3 Days to Kill Kevin Costner plays a muchputupon CIA assassin in Paris with bad guys to dispatch and childcare issues"
"3 Geezers!","In Michelle Schumachers 3 Geezers old people are living it up in their golden years"
"30 Minutes or Less","In 3o Minutes or Less Jesse Eisenberg plays a pizza delivery man forced into a bank heist by a couple of slackers Its supposed to be a comedy"
"32 Pills: My Sister's Suicide","Hope Litoffs documentary becomes more voyeuristically gripping as it progresses"
"36 Saints","Survivors of a plane crash are dying in 36 Saints and two detectives try to stop the apparently supernatural forces behind the killings"
"37","This version of the story returns to the popular but discredited belief that dozens of people deliberately ignored the cries of Ms Genovese"
"4 Days in France","In a directors feature debut an impulsive wanderer flees Paris for adventures in rural France"
"4 Moons","82204 Moons8221 is Sergio Tovar Velarde8217s look at gay boys and men in today8217s Mexico"
"42","42 Brian Helgelands new film about Jackie Robinson is blunt simple and sentimental using timetested methods to teach a clear and rousing lesson"
"47 Meters Down","Mandy Moore and Claire Holt play sisters looking for adventures in Mexico but being stuck in a cage on the ocean floor wasnt what they had in mind"
"47 Ronin","Keanu Reevess presence is not the only Hollywood intrusion into a Japanese legend that is the basis for 47 Ronin"
"5 Star Day","Five Star Day follows a young man who sets out to disprove the value of horoscopes as a final project for a college course"
"50/50","In 5050 when Joseph GordonLevitts character receives a diagnosis of cancer his pal played by Seth Rogen is there with support and leavening humor"
"6 Days","Toa Frasers film about a hostage crisis at the Iranian Embassy in London in 1980 can feel closer to a reenactment than a thriller"
"7 Minutes","Three friends decide to commit a crime greatly underestimating the difficulty"
"7 Sins Forgiven","Vishal Bhardwajs 7 Khoon Maaf a meandering black widow tale has plenty of art But it floats around ungrounded in anything like emotional reality"
"90 Minutes in Heaven","This movie based on a bestselling memoir dwells on the physical and spiritual recovery of Don Piper a Texas pastor who was declared dead in a car crash"
"A Bad Moms Christmas","Christine Baranski Cheryl Hines and Susan Sarandon join the cast for a sequel to Bad Moms"
"A Ballerina's Tale","Nelson Georges documentary delves into the talent and drive  and the careerthreatening injuries  of American Ballet Theaters first black female principal dancer"
"A Band Called Death","The music documentary A Band Called Death catches up with a groundbreaking punk group that emerged in 1970s Detroit"
"A Beautiful Planet","Images of the planet and even mundane tasks take on a fascinating quality in this documentary shot by astronauts aboard the International Space Station"
"A Brave Heart: The Lizzie Velasquez Story","Sara Hirsh Bordo directing her first feature keeps the scenes bright and fastmoving but several important topics about Ms Velasquez are are barely addressed"
"A Brighter Summer Day","A Brighter Summer Day the director Edward Yangs chronicle of disaffected youth in Taiwan in 1960 seethes with the spirit of confused ardent rebellion"
"A Brilliant Young Mind","A young mathematical genius played by Asa Butterfield struggles with his autism and the aftermath of his father8217s death"
"A Christmas Horror Story","Three directors combine to make this addition to the scaryholidaymovie genre which includes William Shatner as a Christmas Eve DJ"
"A Coffee in Berlin","A Coffee in Berlin Jan Ole Gersters feature film debut follows a young mans twisting path"
"A Cure for Wellness","This thriller from Gore Verbinski makes for a nice game of Name That Movie Influence as it treads the boundary between homage and outright plagiarism"
"A Family Affair","The Dutch documentarian Tom Fassaert pursues his own history beginning with his 95yearold grandmother in South Africa"
"A Faster Horse","This film celebrates the 50th anniversary of the car from its mid1960s beginnings to today"
"A Fragile Trust","Samantha Grants documentary A Fragile Trust comes a decade after the fraud scandal at The New York Times perpetrated by the reporter Jayson Blair"
"A German Life","Did Goebbelss secretary do anything more than type This documentary lets viewers judge"
"A Good American","Friedrich Mosers documentary employs reenactments moving graphics and a Philip Glasslike score"
"A Good Day to Die Hard","Bruce Willis takes his fifth turn playing John McClane this time in Moscow in the stuntloaded film A Good Day to Die Hard"
"A Gray State","Erik Nelsons documentary centers on the aspiring filmmaker David Crowley whose violent death became a cause for conspiracy theorists"
"A Haunted House","Marlon Wayans stars in A Haunted House a horror movie parody directed by Mike Tiddes"
"A Haunted House 2","Marlon Wayans stars in A Haunted House 2 his second stop in this horrorspoof franchise"
"A Horrible Way to Die","Adam Wingards Horrible Way to Die turns a typical idea into an unexpectedly novel thriller"
"A LEGO Brickumentary","A movie explores the uses from artistic to therapeutic of a ubiquitous toy"
"A Life in Dirty Movies","8220A Life in Dirty Movies8221 explores the work of Joe Sarno known for his 1960s softcore films and his long relationship with his wife and collaborator Peggy"
"A Little Bit of Heaven","A carefree advertising whiz wont let cancer get in the way of romance or her sense of humor in A Little Bit of Heaven"
"A Little Help","A Little Help stars Jenna Fischer as a Long Island dental hygienist whose life is deteriorating around her"
"A Love Affair of Sorts","A Love Affair of Sorts is a critique of what we already know so well were selfabsorbed and shallow"
"A Man Called Ove","Adapted from a bestselling Swedish novel this film stars Rolf Lassgard as a gruff unemployed railroad worker who befriends immigrants who are his new neighbors"
"A Marine Story","Closeted forced out of the service and now facing identity issues at home"
"A Million Ways to Die in the West","The oneman comedy juggernaut Seth MacFarlane directed himself in this western spoof"
"A Moment of Silence","This documentary centers on the first Bolivian president to rise from the countrys indigenous majority"
"A Monster Calls","Liam Neeson is the voice of a giant tree that helps a child with a vivid imagination through difficult times"
"A Most Wanted Man","In A Most Wanted Man a grim German intelligence agent played by Philip Seymour Hoffman zeros in on a Chechen whom he believes he can link to terrorist cells"
"A Nightmare on Elm Street","This newly rebooted Nightmare on Elm Street tries to recapture some of the grisly wit of the original"
"A Novel Romance","A Novel Romance centers on a middleaged schlub and the attractive young women he inexplicably attracts"
"A Perfect Day","Benicio Del Toro and Tim Robbins star in this Fernando Len de Aranoas film set in the Balkan countryside in 1995"
"A Royal Night Out","In this fantasy directed by Julian Jarrold two princesses escape incognito to commune with the joyful masses on the day Word War II ended in Europe"
"A Single Man","Colin Firth wears the face of grief in Tom Fords directorial debut A Single Man"
"A Space Program","Van Neistats film is the record of the artist Tom Sachss installation that amused audiences at the Park Avenue Armory in 2012"
"A Strange Course of Events","A clerical worker at a hospital in Israel decides on impulse to visit his estranged father in HaifaThey havent see each other in five years"
"A Street Cat Named Bob","With Bob on his shoulder a homeless busker James is able to face just about anything  a negligent father street ruffians and drug withdrawal"
"A Taxi Driver","Jang Huns drama recalls the efforts of the German TV journalist Jrgen Hinzpeter and a cabby he hired to record the Gwangju uprising in 1980"
"A Teacher","In Hannah Fidells debut feature a young high school teacher has an affair with one of her teenage students"
"A Thousand Words","In A Thousand Words Eddie Murphy plays a literary agent who is magically connected to the fate of a tree"
"A Walk Among the Tombstones","In 8220A Walk Among the Tombstones8221 the private investigator Matthew Scudder from the Lawrence Block novels pursues a case that leads him to an underworld of brutality"
"A Walk in the Woods","Mr Redford stars with Nick Nolte in this film based on Bill Bryson8217s 1998 chronicle of hiking the Appalachian Trail with an old friend"
"A Will for the Woods","A Will for the Woods is a documentary about natural burial that focuses on a psychiatrist as he prepares for his death"
"A Woman Like Me","Dying of cancer the director Alex Sichel kept a video diary while creating a fictional account of her treatment"
"A Woman, a Part","In Elisabeth Subrins feature a nuanced take on friendship and professional frustration an actress finds that early relationships can fade"
"A World Not Ours","In A World Not Ours the director Mahdi Fleifel interviews generations of family in the crowded Palestinian refugee camp where he lived before moving to Denmark"
"A Year Ago in Winter","A Year Ago in Winter doesnt succumb to the usual weepieoftheweek clichs"
"Aarakshan","In Aarakshan a teacher in India battles the hucksters who want to make education a commodity available only to the privileged"
"Aashayein","Nagesh Kukunoors Aashayein is a genredefying Bollywood look at death"
"ABCD 2 (Anybody Can Dance 2)","The leader of the Mumbai Stunners troupe hopes to turn around the group8217s fortunes in this Remo D8217Souza Bollywood sequel"
"Abduction","Taylor Lautner stars in Abduction There is also a plot of sorts"
"Abendland","The documentary Abendland directed by Nikolaus Geyrhalter uses images of Europe at night to explore the ideas of constructed nationalism and political community"
"Abortion: Stories Women Tell","Both sides are addressed in this documentary which largely focuses on viewpoints and personal experiences in Missouri and Illinois"
"About Last Night","About Last Night a raucously entertaining remake follows the difficulties faced by two couples one sensitive and well behaved the other outrageously naughty"
"About Time","A Hugh Grant wannabe Domhnall Gleeson and his father Bill Nighy indulge the supernatural talent shared by the men in their family"
"Above and Beyond","The documentary Above and Beyond recounts the story of Jewish American pilots who secretly fought for Israel during its War of Independence"
"Abraham Lincoln: Vampire Hunter","In Abraham Lincoln Vampire Hunter where the vampires are white Southerners whose cause is enslaving human beings there are enough bodies to paint the screen red"
"Absolutely Fabulous: The Movie","Jennifer Saunders and Joanna Lumley are back as Eddy and Patsy in this happily selfconscious featurelength goof a film iteration of the BBC TV series"
"Act of Valor","In Act of Valor real members of the Navy SEALs show off what they do in a concocted story complete with a kidnapped CIA officer and a hooknosed villain"
"Actor Martinez","Acting may be his first love but the title character in Actor Martinez soon learns its no picnic  especially when dealing with his directors"
"Addicted","8220Addicted8221 a film by Bille Woodruff is a cautionary tale of a restless businesswoman who seems to have it all but descends into sex addiction"
"Admission","Tina Fey stars as an admissions officer at Princeton in Admission a comedy directed by Paul Weitz"
"Adult World","In Adult World an aspiring 22yearold poet takes the only job she can find as an assistant in a pornographic bookstore but persists in a fantasy about literary renown"
"Affluenza","In Affluenza Kevin Aschs take on millennials pot sex and golf are plentiful but everyone continues to sulk"
"African Cats","African Cats tells the story of lions and cheetahs and the power of mother love"
"After","The drama After centers on a secret that could greatly affect an upstate New York family"
"After Auschwitz","The documentary traces the experiences of six women who settled in the United States after the end of World War II"
"After Earth","After Earth the Will SmithJaden Smith vehicle directed by M Night Shyamalan a boy and his dad crashland on a planet that their ancestors ruined and fled"
"After Love","A couple break up but remain together frustratingly because of the husbands financial woes"
"After Words","Romance is the last thing on the mind of Marcia Gay Harden8217s character when she begins a tour of Costa Rica with a personal guide"
"Aftermath","In Aftermath by Peter Engert a cellarbound gang of desperate survivors tries to cope after a global nuclear catastrophe"
"Agrarian Utopia","Uruphong Raksasads Agrarian Utopia focuses on two families of farmers in Thailand"
"Ain't Them Bodies Saints","Aint Them Bodies Saints a moody westernish crime drama written and directed by David Lowery stars Rooney Mara and Casey Affleck"
"AL DI QUA (Life/Here)","In this film Turins poorest tell their stories to the camera"
"Alamar","In Alamar by Pedro GonzlezRubio a boy takes the journey of a lifetime with his Mexican father"
"Alex Cross","Tyler Perry plays the title character in Alex Cross based on a James Patterson novel"
"Alex of Venice","Mary Elizabeth Winstead plays a character much like Dustin Hoffman8217s in 8220Kramer vs Kramer8221 in Chris Messina8217s directorial debut"
"Alexander and the Terrible, Horrible, No Good, Very Bad Day","8220Alexander and the Terrible Horrible No Good Very Bad Day8221 includes Steve Carell and Jennifer Garner in its adaptation of Judith Viorst8217s children8217s book"
"Alice in Wonderland","Tim Burtons Alice in Wonderland is busy garish and periodically amusing"
"Alice Through the Looking Glass","This sequel to Tim Burtons Alice in Wonderland directed by James Bobin offers a world of grotesque overabundance cluttered with specialeffects gadgetry"
"Alien: Covenant","The new entry in Ridley Scotts longlived franchise is committed to the canny management of expectations but that doesnt diminish its creepiness"
"Alina","Ben Barenholtz kickstarted the career of David Lynch But his first fiction feature shows he has not mastered directing"
"All Eyez on Me","Benny Booms film fails the considerable talent of the complex rapper it chronicles and the actor portraying him Demetrius Shipp Jr"
"All I See Is You","This psychodrama from Marc Forster stars Blake Lively and Jason Clarke as a seemingly happy married couple"
"All Mistakes Buried","Directed by Tim McCann the film stars Sam Trammell as a reprobate who takes on dangerous criminals in an effort to save his marriage"
"All Relative","Having two relationships at once causes complications for a graduate student in the comedy 8220All Relative8221"
"All the Light in the Sky","All the Light in the Sky asks questions about human nature the march of time and global warming"
"All the Rage (Saved by Sarno)","This documentary looks at Dr John Sarno who posits that many types of chronic pain particularly back pain are caused by stress and repressed emotions"
"All These Sleepless Nights","A Polish film follows its young protagonist as he flirts attends parties until dawn and gyrates to a perpetual backbeat"
"All Things Must Pass","This documentary tracks the rise and fall of the Tower franchise and notes its influence on some of the biggest names in music"
"All This Panic","This limber lightfooted documentary becomes a sort of dreamy film diary for the girls it profiles"
"All We Had","A teenage girl and her downtrodden mother struggle to build a normal life but any progress they make seems to unravel"
"All You Need Is Love","The Good Morning School for Burmese children in Thailand is the subject of Stuart Cameron8217s documentary 8220All You Need Is Love8221"
"Allegiant","Allegiant the first part of the Divergent series finale takes moviegoers to the creepy confines of the Bureau of Genetic Welfare"
"Allure","The Occupy movement is a backdrop to this film about four women from different countries and diverse backgrounds and their American experiences"
"Almayer's Folly","Almayers Folly a tropical study in helpless intransigence adapted from Conrads oftenoverlooked debut novel"
"Almost Holy","This documentary by Steve Hoover examines Gennadiy Mokhnenko a pastor in Ukraine who rehabilitates homeless children at his center Pilgrim Republic"
"Almost There","This documentary from Dan Rybicky and Aaron Wickenden follows the story of Peter Anton an artist in Indiana"
"Alms for a Blind Horse","The writer and director Gurvinder Singhs film Alms for a Blind Horse shows situations during a day and a night in the Punjab in northwestern India"
"Aloha","Cameron Crowes loose and leisurely film can be enjoyed the way you enjoy a catchup beer with an old friend you dont have much in common with anymore"
"Along for the Ride","Dennis Hoppers life could be seen as a wild ride on and off the screen Someone who was by Hoppers side interprets his story"
"Along With the Gods: The Two Worlds","This delirious fantasy from Kim Yonghwa adapted from a web comic buries story clarity and emotional depth under a mountain of visual pyrotechnics"
"Alpha and Omega","A talkinganimal tale of two wolves starcrossed lovers that are captured in the Canadian Rockies and shipped to Idaho"
"Already Tomorrow in Hong Kong","Written and directed by Emily Ting this film tells of two Americans who run into each other on the streets of a glittering city"
"Altered States of Plaine","In Altered States of Plaine the protagonist finds himself in a new location without any sense of how he got there any time he dozes off"
"Altiplano","Jasmin Tabatabai and Magaly Solier are grieving women from different worlds in a tale of ecological exploitation"
"Alumbrones","Alumbrones a documentary by Bruce Donnelly focuses on Cuban artists whose creative lives have been defined by scarcity"
"Alvin and the Chipmunks: Chipwrecked","The Chipmunks go on a cruise that ends badly with the Chipettes along for the ride"
"Alvin and the Chipmunks: The Road Chip","In this fourth installment of the series the Chipmunks travel to Florida when they think their human minder Dave is getting too chummy with his girlfriend"
"Always Woodstock","8220Always Woodstock8221 centers on an aspiring singersongwriter who strikes out in New York City and moves back to her childhood home"
"American Assassin","American Assassin the first adaptation of a series of thrillers stars Dylan OBrien as a rogue CIA killer and Michael Keaton as grizzled mentor"
"American Empire: An Act of Collective Madness","Patrea Patricks American Empire posits that multinational corporations have created a cartel economy bent on world domination"
"American Fable","Anne Hamiltons film seems full of suspenseful promise as it opens on an isolated swath of the countrys heartland but the story finds no traction"
"American Hero","Stephen Dorff stars as Melvin an absentee dad who has the power to move objects with his mind in this movie written and directed by Nick Love"
"American Made","Mr Cruise plays a reallife pilot turned smuggler who worked for the CIA in Doug Limans new movie"
"American Made Movie","American Made Movie pins the decline of the manufacturing sector on forces seemingly beyond anyones control and the hopes for reversing it on plucky individuals"
"American Pastoral","Ewan McGregors directorial debut is a shallow but watchable gloss on this Roth novel conjuring a searing image of the disintegrating American dream"
"American Reunion","Jason Biggs Seann William Scott and Eugene Levy return for the fourth installment of the American Pie franchise"
"American Sniper","Clint Eastwoods latest film is about Chris Kyle a Navy SEAL who served tours of duty in Iraq"
"American Teacher","The documentary American Teacher is a heartfelt bittersweet portrait of several teachers as they decide whether to stay in the lowpaying profession"
"American Ultra","Kristen Stewart and Mr Eisenberg pair up again in this film an action adventure with CIA trouble and occasional laughs"
"American: The Bill Hicks Story","Paul Thomas and Matt Harlocks documentary looks at the life of the comedian Bill Hicks"
"Amira & Sam","In Sean Mullin8217s 8220Amira  Sam8221 an Army veteran and aspiring comedian becomes the protector of his old Iraqi translator8217s beautiful relative"
"Among Ravens","In Among Ravens relatives and their problems gather at a Fourth of July getaway"
"Among the Believers","This documentary takes the viewer inside the Islamic schools in Pakistan run by the fiery Abdul Aziz"
"An Education","If in hindsight An Education might make you a little queasy it is hard to resist"
"An Open Secret","In this documentary directed by Amy Berg former child actors recount the manipulations coverups and exploitations they encountered in the entertainment industry"
"Anchorman 2: The Legend Continues","Will Ferrell stars in Anchorman 2 The Legend Continues a sequel now set in the 1980s and the era of cable"
"And Now a Word From Our Sponsor","In And Now a Word From Our Sponsor an ad executive is reduced to speaking only in slogans"
"And So it Goes","Michael Douglas plays a crabby old guy who gets together with his nextdoor neighbor Diane Keaton in the comedy And So It Goes"
"And They're Off","And Theyre Off  is a horseracing mockumentary about a losing trainer who gets a big chance"
"Andron","A knockoff of The Hunger Games and The Maze Runner this film adds up to less than the sum of its parts"
"Angels Crest","Gaby Dellals new film Angels Crest depicts the pain of a small town and a young father after a tragedy"
"Animals","A collegeeducated middleclass couple create a selfcontained civilization in which heroin is a powerful force within their personal love story"
