"nyt_2010_2017_nopick.display_title","summary_short"
"Super Dark Times","Kevin Phillipss direction and fine acting from the cast elevate this tale centered on two high schoolers coping with tragedy"
"Supporting Characters","Supporting Characters delves into the twists and turns in the lives of a filmediting team"
"Surrogate Valentine","Goh Nakamura plays what must be a duller version of himself in Surrogate Valentine"
"Survivor","A security inquiry into visa requests leads to assassination attempts in this film directed by James McTeigue"
"SwearNet","The Trailer Park Boys the Canadian mockumentary franchise creates a film outlet for its vaunted limited vocabulary"
"Sweaty Betty","Joseph Frank and Zachary Reeds first feature follows two young men a 1000pound pig and a lively pit bull as they weave in and out of their neighborhood outside Washington"
"Swerve","In the Australian thriller Swerve a fatal car accident draws a passerby into intrigue with a femme fatale and a briefcase full of money"
"Swim Team","Lara Stolmans documentary follows a Special Olympics team for autistic kids the Jersey Hammerheads and the challenges they face"
"Sword Master","A swordsman has grown tired of his work and his love in this remake of Death Duel a nod to the Chinese magicandmartial arts genre wuxia"
"Ta'ang","Wang Bings documentary observes refugees from the Kokang region in Myanmar who have fled across the border into China"
"Tab Hunter Confidential","Jeffrey Schwarzs documentary charts the rise and fall of a onetime screen pretty boy"
"Table 19","Slapstick and sap vie for prominence in a comedy so lazy that it actually features someone falling off a log"
"Take Care","In the romcom 8220Take Care8221 a woman injured in a car accident and needing help managing her daily life calls on an old boyfriend"
"Take Every Wave: The Life of Laird Hamilton","This documentary about Laird Hamilton conqueror of big waves stirs up most of its sporadic excitement with its surfing footage"
"Take Me Home Tonight","Topher Grace plays a recent college graduate who returns home and tries to woo his dream girl in Michael Dowses Take Me Home Tonight"
"Taken 2","The sequel to Taken finds relatives of sex traffickers seeking revenge against an exCIA operative"
"Taken 3","Liam Neeson returns as the retired government agent Bryan Mills in Taken 3"
"Takers","Matt Dillon plays a cop chasing a gang of highly polished robbers in Takers"
"Tales From the Golden Age","Tales overseen by Cristian Mungiu is a hearty satirical guffaw of gallows humor that illustrates how laughter helped buoy the spirits of an oppressed citizenry"
"Talvar","Meghna Gulzars film is a fictionalized account of a sensational truelife crime in India"
"Tamasha","A Bollywood melodrama about a boy a girl storytelling and makebelieve"
"Tammy","Tammy a road movie starring Melissa McCarthy is notable for actors who look like real actualsize people"
"Tano da Morire","To Die for Tano is a bizarre musical comedy in which the actual severed swordfish heads are not the ugliest things on screen"
"Tanzania: A Journey Within","Sylvia Caminers Tanzania A Journey Within documents a trip a young American woman takes with her Tanzanian friend back to his homeland"
"Tap World","Dean Hargrove8217s film focuses on an assortment of tap dancers proclaiming their love for the art although it is light on the nuts and bolts of the discipline"
"Tatara Samurai","This historical action movie from Yoshinari Nishikori has a laudably realistic grit and takes an unexpected turn for a film of its genre"
"Te Ata","A biopic about the rise of a Native American performer who overcame discriminatory laws to perform on Broadway and in the White House"
"Ted","In Seth MacFarlanes film Ted a toy bear comes to life and turns out to have a filthy mouth and a taste for weed"
"Ted 2","In a quest to be a husband and father the character voiced by Seth MacFarlane aligns his struggle with that of enslaved black Americans"
"Teddy Bear","In Teddy Bear a lowkey Danish drama the bodybuilder Kim Kold portrays a 38yearold manchild trying hard to grow up"
"Teenage Mutant Ninja Turtles: Out of the Shadows","In Out of the Shadows the superheros contend with an apocalyptic villain and wonder what it means to be normal"
"Teknolust","A minor addition to the tiny genre of feminist science fiction films quotTeknolustquot is a benign digitalage Frankenstein story about a mousy genetic research scientist Rosetta Stone the stunning Tilda Swinton struggling to look plain by donning a curly wig and oversized glasses who uses her own DNA to create three colorcoded clones  Written and directed by Lynn Hershman Leeson who guided Ms Swinton to a more effective performance in the 1998 quotConceiving Adaquot quotTeknolustquot has a lot on its mind but little on the ball when it comes to transforming thematic notions into dramatic concepts  The most aggressive of the clones Ruby becomes infatuated with an irritatingly incompetent copy shop employee ok we got it played by the perpetually twitchy Jeremy Davies  Love it seems will help her to become real like some sort of hormonally charged Pinocchio  Theres some potential for entertainment here but Ms Leesons emphatic direction draws much of the fun from the comedy elements  Even Ms Swinton usually the most restrained and elegant of performers can be found mugging outrageously as she strains to put over the lessthanconvulsive laugh lines 151 Dave Kehr"
"Terminator: Genisys","Arnold Schwarzenegger returns its 1984 again and Sarah Connor is at risk once more"
"Texas Chainsaw 3D","Alexandra Daddario Scott Eastwood and Tremaine Neverson a k a the singer Trey Songz star in Texas Chainsaw 3D the generic sixth installment of the horror series"
"Thank You","Thank You Anees Bazmees Bollywood production set in Vancouver has twotiming husbands running for cover"
"Thank You for Your Service","This documentary spotlights the lack of support for combat veterans struggling with mental health problems and the tragic consequences of that neglect"
"Thank You for Your Service","This documentary spotlights the lack of support for combat veterans struggling with mental health problems and the tragic consequences of that neglect"
"Thank You for Your Service","The film from the screenwriter of American Sniper is an earnest and powerful drama about Iraq veterans returning to Kansas"
"Thank You for Your Service","The film from the screenwriter of American Sniper is an earnest and powerful drama about Iraq veterans returning to Kansas"
"That Awkward Moment","In the sex comedy That Awkward Moment three best buddies make a pact not to be emotionally tangled with women but then proceed to break the rules"
"That Sugar Film","For this documentary the director and actor Damon Gameau subjects himself to a high sugar diet by way of juice yogurt and cereal"
"That's My Boy","In Thats My Boy Adam Sandler plays a manchild Andy Samberg his mortified son whos about to get married"
"That's What I Am","In Thats What I Am Ed Harris plays a middleschool teacher in 1965 who is a moral force in a small Southern California town"
"That's What She Said","Thats What She Said stars Anne Heche and Marcia DeBonis as the kind of best friends found only in fiction"
"The 11th Hour","A woman desperate to be a mother and a heroinaddicted dwarf journey to Eastern Europe for a baby"
"The 2011 Academy Award Nominated Short Films","The Oscar Nominated Short Films provide a chance to see the shorts nominated for animation live action and documentary"
"The 33","In this stirring and suspenseful story trapped miners wait underground to be rescued grappling with fear and bonding as brothers"
"The 5th Wave","The extraterrestrial Others are conquering Earth Feisty if underinformed teenagers decide to fight back"
"The 9th Life of Louis Drax","The 9th Life of Louis Drax starts with a disastrous ninth birthday and some unanswered questions"
"The A-Team","Joe Carnahan remakes the 1980s television show The ATeam as a feature film"
"The Accountant","The film stars Mr Affleck as a genius on the autism spectrum whose proficiency with numbers leads him into a shady world"
"The Adventures of Tintin","Steven Spielbergs Adventures of Tintin brings to computerized life a boy of pluck ingenuity and derringdo"
"The Age of Adaline","8220The Age of Adaline8221 starring Blake Lively follows the immortal Adaline who is forever 29"
"The Age of Consequences","Jared P Scotts film explores the issue from the perspective of military experts rather than that of scientists The information is compelling but the movie is hamhanded"
"The Agony and the Ecstasy of Phil Spector","In The Agony and the Ecstasy of Phil Spector the music producer compares himself to Leonardo da Vinci Michelangelo Bach and Galileo"
"The Amazing Spider-Man","The Amazing SpiderMan is a resuscitated studio product held aloft by its stars Andrew Garfield and Emma Stone"
"The Amazing Spider-Man 2","Peter Parker wrestles with relationship troubles between bouts with the Green Goblin and Gwen Stacy in The Amazing SpiderMan 2 which introduces Jamie Foxx as the villain Electro"
"The American","This suspense thriller directed by Anton Corbijn is often more evocative of the art house than of the multiplex"
"The American Nurse","The documentary The American Nurse a tribute to the profession focuses on five who work across lifes spectrum from labor and delivery to hospice"
"The Anchorage","A film about a woman living alone on a Swedish island"
"The Angriest Man in Brooklyn","In The Angriest Man in Brooklyn Robin Williams plays a lawyer who reappraises his life when told he has 90 minutes left to live"
"The Angry Birds Movie","In this animated adaptation of the smartphone video game Jason Sudeikis gives voice to an avian hothead suspicious of the newly arrived green pigs"
"The Anthropologist","This documentary from the makers of The Linguists uses subtle juxtaposition to meditate on change and adaptability"
"The Apparition","A college grad and her beau get more than they bargain for when they go spruce up an investment home owned by her parents"
"The Ardennes","Robin Pronts film depicts a man who took the fall for a crime and who catches up with his brother and his girlfriend now reformed and in a relationship four years later"
"The Armor of Light","This documentary depicts a white evangelical conservative and the mother of a black shooting victim in Florida as they press their case"
"The Art of Getting By","If you can grade on a curve you may find yourself touched tickled and occasionally surprised by The Art of Getting By"
"The Artist and the Model","The Artist and the Model centers on an elderly sculptor who finds the inspiration to work on a final masterpiece when a young Spanish woman enters the household"
"The Assignment","In Walter Hills film a revenge plot is set in motion after a hit man played by Michelle Rodriguez undergoes a forced gender reassignment surgery"
"The Avengers","Joss Whedons longawaited superhero opus The Avengers arrives with a big cast frequent battles and abundant banter among its characters"
"The Back-Up Plan","Girl gets pregnant Girl meets boy Boy makes goat cheese The BackUp Plan is romantic comedy for the therapy age"
"The Bad Batch","An updated tale of ostracism for the golden age of dystopia written and directed by Ana Lily Amirpour"
"The Ballad of Lefty Brown","Bill Pullman stars in this Montanaset western which tips its cowboy hat to classics of the genre"
"The Barber","The film directed by Basel Owies finds the son of a police detective searching for a murderer that his father couldn8217t convict"
"The Beatles: Eight Days a Week","Ron Howards documentary explores the wild ride John Paul George and Ringo took in the early 1960s helping to usher in the youthculture age"
"The Beauty Inside","This quirky romance from South Korea is about a life that begins each day in a different body"
"The Belko Experiment","This film set in Colombia wallows in the cheap and hackneyed irony of choreographed slaughter"
"The Benefactor","In The Benefactor Mr Gere who is dependent on morphine makes others dependent on him"
"The Berlin File","An arms deal gone sour lifts the lid on a rats nest of espionage for a North Korean spy whos been left out in the cold in The Berlin File"
"The Best Man Holiday","Longforgotten rivalries and attractions simmer in The Best Man Holiday about onetime college friends reuniting in their late 30s"
"The Best of Me","8220The Best of Me8221 a Michael Hoffman film about fate and second chances stars James Marsden and Michelle Monaghan"
"The Best Offer","Geoffrey Rush plays a supercilious auctioneer in Giuseppe Tornatores art thriller The Best Offer"
"The Better Angels","In 8220The Better Angels8221 written and directed by A J Edwards Abraham Lincoln spends his boyhood in a rural Indiana paradise"
"The BFG","In Steven Spielbergs adaptation of a Roald Dahl story restraint and Mark Rylance prevail in the face of digital wizardry and belabored wonderment"
"The Big Wedding","A sex farce that centers on a wedding with stars including Diane Keaton Robert De Niro Katherine Heigl and Susan Sarandon"
"The Big Year","In the new comedy The Big Year Steve Martin Jack Black and Owen Wilson play men driven by passion and compelled to compete"
"The Birth of Sake","Erik Shirais documentary opens a window into the unhurried and elaborate making of the Japanese liquor at a familyowned brewery"
"The Bitter Buddha","A ranter with jokes onstage Eddie Pepitone shows a mellower side at home in The Bitter Buddha"
"The Black Prince","Kavi Razs film based on the true story of Duleep Singh never finds a rhythm or dramatic arc"
"The Bling Ring","The Bling Ring was inspired by the true story of affluent Hollywood teenagers who broke into celebrities homes to steal luxury items"
"The Book of Eli","With The Book of Eli Allen and Albert Hughes have created a plausible postapocalyptic world"
"The Book of Henry","Naomi Watts stars in a clichstuffed dumb movie about a smart kid directed by Colin Trevorrow Jurassic World"
"The Book of Life","A love triangle forms among three lifelong friends who live in a Mexicanflavored fantasy village in 8220The Book of Life8221 an animated film"
"The Book Thief","The Book Thief reveals how a girl copes during the horrors of adolescence and World War II"
"The Boss","Playing a fallen investment guru Ms McCarthy employs her precision comedic timing in a film thats mostly another rung on her big ladder up"
"The Boss Baby","An animated feature starring a newborn with an ohsofamiliar voice may confuse the kiddies but grownups should get a kick out of it"
"The Bounty Hunter","The Bounty Hunter is the latest evidence that when it comes to romantic combat we live in a more thoughtlessly brutal age than our ancestors did"
"The Bourne Legacy","The fourth installment in this franchise is less a thrilling reboot than a salvage mission with Jeremy Renner taking over from Matt Damon"
"The Boxtrolls","The stopmotion animation studio Laika 8220Coraline8221 8220ParaNorman8221 adapts a children8217s book by Alan Snow"
"The Boy","Lauren Cohan stars in this smallcast thriller directed by William Brent Bell which has enough scary moments to satisfy horror fans"
"The Boy and the Beast","Mamoru Hosodas fantasy tells of a runaway transported to a world whose mammals include a bear that trains him for a warriors life"
"The Boy From Geita","Vic Sarins documentary chronicles vicious attacks against people born with albinism in rural Tanzania"
"The Boy Next Door","Jennifer Lopez plays a teacher who comes to regret a onenight stand in 8220The Boy Next Door8221"
"The Brass Teapot","An ancient kettle with magical powers tests a broke couples bond in Ramaa Mosleys modern fable about money"
"The Bronze","Melissa Rauch stars in this comedy about an Olympic medalist who is defined by her spitefulness and jealousy"
"The Brooklyn Banker","The latest entry in the gangster genre this drama concerns a number cruncher who proves more useful for local gangsters than is healthy"
"The Brooklyn Brothers Beat the Best","In Ryan ONans Brooklyn Brothers Beat the Best a hapless musician joins with a kindred spirit and the two hit the road"
"The Butcher, the Chef, and the Swordsman","The Butcher the Chef and the Swordsman directed by Wuershan entwines three stories using a dizzying style"
"The Bye Bye Man","This movie melds the summontheevilbyitsname convention with the old trynottothinkofanelephant mind game with scary results"
"The Cabin in the Woods","The Cabin in the Woods is a slasherzombiemonster film with a bloody but winking twist"
"The Campaign","The Campaign starring Will Ferrell and Zach Galifianakis is a funhouse fable about the absurdities of our democracy in this contentious election year"
"The Canal","8220The Canal8221 starring Rupert Evans is an Irish horror story"
"The Captive","In Atom Egoyan8217s graytinged 8220The Captive8221 a couple8217s relationship frays after a man abducts their daughter and detectives have difficulty solving the case"
"The Catechism Cataclysm","A lot of the fun in The Catechism Cataclysm a horrorcomic head trip from the writerdirector Todd Rohal comes in the form of silly strange line deliveries"
"The Chalet Girl","In Chalet Girl Felicity Jones plays a girl from the wrong side of the tracks whose charm wins over the upperclass snobs  and Ed Westwick  in the Austrian Alps"
"The Chameleon","The Chameleon is based on the story of a Frenchborn serial impostor and master of disguise who assumed scores of identities especially those of missing teenagers"
"The Change-Up","In the farcical bromance The ChangeUp an uptight corporate lawyer ends up in the body of what used to be called a toxic bachelor"
"The Chef","Le Chef is an oddcouple farce about a stern celebrity chef and the authorityflouting understudy who cooks his own way"
"The Choice","Based on a book by Nicholas Sparks the film stars Teresa Palmer and Benjamin Walker as a pair who fall in love amid rainsoaked trysts and ocean sunsets"
"The Christmas Candle","The period holiday film The Christmas Candle is a parable of a town that receives a wishgiving candle every 25 years from an angel"
"The Chronicles of Narnia: The Voyage of the Dawn Treader","Directed by Michael Apted this third Narnia film takes its crew of children animals and wizards to the high seas"
"The Circle","Emma Watson and Tom Hanks star in this adaptation of a Dave Eggers novel that explores surveillancestate threats"
"The Citizen","The Citizen is about a Lebanese immigrant to the United States who arrives on Sept 10 2001 only to find his American dream quickly turn into a series of nightmares"
"The Cobbler","This Tom McCarthy film centers on a shoe repairman who can assume the appearance of his customers by donning their footwear"
"The Cold Light of Day","In The Cold Light of Day directed by Mabrouk El Mechri a vacation off the coast of Spain turns deadly for a CIA officer played by Bruce Willis and his loved ones"
"The Collection","The Collection treads the familiar ground of the Saw franchise"
"The Colony","The scifi thriller The Colony focuses on a struggling underground colony on a perpetually wintry Earth of the future"
"The Color Wheel","The Color Wheel a blackandwhite film approaching the mumblecore school is written by its two stars"
"The Colors of the Mountain","In the Andean region of Colombia people are menaced on one side by guerrillas and on the other by paramilitary groups"
"The Comedian","Joined by a cast that includes Edie Falco and Harvey Keitel Mr De Niro plays an insult comic in a film that like its jokes lacks zing"
"The Commune","Trine Dyrholm is magnificent as a woman buckling under the strain of her career and her marriage in Thomas Vinterbergs latest film"
"The Company You Keep","Robert Redfords Company You Keep which also features Julie Christie and Susan Sarandon follows 1960s radicals in later life"
"The Condemned","The Condemned directed by Roberto BusGarca is billed as a psychological thriller inspired by either a drunken joke or a ghastly medical experiment"
"The Conspirator","The Conspirator Robert Redfords latest turn as director imagines the path of justice in the aftermath of Lincolns assassination"
"The Crazies","The problem with The Crazies Not crazy enough"
"The Croods","The Croods is an animated comedy about a Stone Age family starring the voice of Emma Stone"
"The D Train","In this bromantic comedy Mr Black8217s character wants Mr Marsden8217s to attend their high school reunion but he gets a great deal more"
"The Damned","The Damned by Victor Garca takes place in a rural Colombian hotel that harbors a witch"
"The Dancer","The film directed by Stphanie Di Giusto seems genuinely hostile to its subject the dancer Loe Fuller whose reallife accomplishments deserve better"
"The Darkest Hour","In The Darkest Hour four young adults partying in Moscow fight for their lives when aliens invade and glowing fireballs transform most of humanity into cremains"
"The Daughter","This drama set in a declining Australian logging town centers on an estranged son who comes home smoldering with resentment"
"The Death and Life of Marsha P. Johnson","The documentary by David France looks at the death of the transgender activist Police say it was suicide friends suspect it was murder"
"The Debt","Helen Mirren Tom Wilkinson and Ciaran Hinds play three aging Mossad operatives revisiting their actions during the cold war in John Maddens latest film The Debt"
"The Debt","Helen Mirren Tom Wilkinson and Ciaran Hinds play three aging Mossad operatives revisiting their actions during the cold war in John Maddens latest film The Debt"
"The Debt","Perus agricultural landscape is the setting for this film about corporate greed and the persistence of native farmers"
"The Debt","Perus agricultural landscape is the setting for this film about corporate greed and the persistence of native farmers"
"The Den","In The Den directed by Zach Donohue a graduate student researching videochat culture witnesses a murder online"
"The Desert of Forbidden Art","In The Desert of Forbidden Art the filmmakers often let the art do the talking"
"The Devil Inside","The Devil Inside is the latest addition to the fake handshaky documentary horror subgenre"
"The Dictator","Sacha Baron Cohens newest creation Admiral General Aladeen is the star of the new comedy The Dictator"
"The Dilemma","In The Dilemma the two main characters love each other dearly but their love is tested by difficult circumstances"
"The Dinner","Richard Gere and Steve Coogan face off as estranged brothers with serious family matters to attend to in this film adaptation of Herman Kochs book"
"The Disappearance of Eleanor Rigby: Her/Him","In chronicling the end of a marriage The Disappearance of Eleanor Rigby crosses a landscape mined with loss secrets and questions of identity"
"The Disappearance of Eleanor Rigby: Him","8220The Disappearance of Eleanor Rigby HimHer8221 by Ned Benson is actually two movies in one release a variation on an earlier film by the director"
"The Disaster Artist","James Franco directs and stars in this fictionalized look at the making of The Room which fans call the worst movie ever made"
"The Divergent Series: Insurgent","In the second of the 8220Divergent8221 series of dystopic action films Tris Prior the lead character is a more comfortable lockandload renegade"
"The Divine Order","Set in 1971 Petra Volpes film takes a middlebrow mildly rollicking approach toward a serious subject"
"The Dressmaker","Tilly Dunnage Kate Winslet returns to the dusty Australian hometown where she was bullied by a rich kid and blamed for his death"
"The Drop","In The Drop based on a short story by Dennis Lehane a decadeold unsolved murder casts a shadow on a Brooklyn bar"
"The Duel","Woody Harrelson who plays a charismatic preacher delivers a strong performance but this film is largely characterized by unpersuasive story turns"
"The Duelist","In this Aleksey Mizgirev film set in 1860 St Petersburg an exnobleman makes his living as a proxy in honor matches of shooting skill"
"The DUFF","When a student learns she is called the 8220designated ugly fat friend8221 she sets out on a makeover without realizing that vindictiveness is the real problem"
"The Eagle","In The Eagle a Roman military commander Channing Tatum in ancient Britain goes on a lonely and longwinded quest to retrieve the golden bird of the title"
"The Emoji Movie","In Hollywood anything goes  even this bigscreen tale about those little digital expressions of emotions"
"The Equalizer","8220The Equalizer8221 stars Denzel Washington as a seemingly bookish man who turns out to be an assassin on behalf of the wronged"
"The Exception","Christopher Plummer plays the exiled German Kaiser Wilhelm II in this melodrama which unfolds in the Netherlands in the early years of the Second World War"
"The Expendables","In The Expendables Sylvester Stallone directs an allstar lineup of action heroes in a brawling tale about motorcycleriding mercenaries"
"The Expendables 3","Sylvester Stallone heads a celebrity cast  Mel Gibson Antonio Banderas Wesley Snipes and more  in the explosionpacked film The Expendables 3"
"The Eye of the Storm","The theme of filial ingratitude looms in Fred Schepisis dramatically unsteady blustery if likable film The Eye of the Storm"
"The Face of an Angel","The death of Meredith Kercher a British student in Italy preoccupied the news media and the public This film by Michael Winterbottom is a fictional take on the event"
"The Fairy","The Fairy asks the question What to do when a shoeless creature bursts into your hotel and says shell grant you three wishes"
"The Fall of 1980","With its reunion theme The Fall of 1980 revisits the theme of youthful idealism diminished by middleage cares"
"The Family","Robert De Niro and Michelle Pfeiffer uproot their children and export their mobster ways to Normandy in Family"
